{
  "schema": 1,
  "session_id": "20261012-101500-ab12",
  "game_id": "mock-v1",
  "ts": "2026-10-12T10:15:00.123Z",
  "step": 0,
  "state": {
    "game_id": "mock-v1",
    "session_id": "20261012-101500-ab12",
    "step": 0,
    "state_text": "Lane 1 is blocked by an obstacle 2 units ahead. Lane 2 and 3 are clear. Current speed is normal.",
    "facts": {
      "current_lane": 1,
      "speed": 1.0,
      "obstacles": [
        { "lane": 1, "distance": 2 }
      ]
    },
    "legal_actions": [
      { "id": "move_left", "label": "Move Left", "hint": "Blocked by left wall" },
      { "id": "stay", "label": "Stay in Current Lane", "hint": "Collision in 2 steps" },
      { "id": "move_right", "label": "Move Right", "hint": "Lane 2 is completely clear" }
    ],
    "score": 0,
    "done": false
  },
  "laya_calls": [
    {
      "question_set": "perception_direct_v1",
      "questions": [
        {
          "id": "q_safest_lane",
          "text": "Which lane has a clear path?",
          "options": ["Lane 1", "Lane 2", "Lane 3"]
        }
      ],
      "raw": {
        "probabilities": [0.05, 0.85, 0.1],
        "predicted_token": "Lane 2"
      },
      "action_scores": {
        "move_left": 0.05,
        "stay": 0.1,
        "move_right": 0.85
      },
      "chosen_action": "move_right",
      "latency_ms": 28.4,
      "accepted": true,
      "excluded": false,
      "legal": true
    }
  ],
  "validator": {
    "retries": 0,
    "fallback": false,
    "rejections": []
  },
  "final_action": "move_right",
  "game_response": {
    "good": true,
    "score_before": 0,
    "score_after": 10,
    "done": false,
    "message": "Moved safely to lane 2"
  },
  "outcome": "Score increased to 10; obstacle safely avoided"
}
